contract_transaction_unique_key,contract_award_unique_key,award_id_piid,modification_number,transaction_number,parent_award_agency_id,parent_award_agency_name,parent_award_id_piid,parent_award_modification_number,federal_action_obligation,total_dollars_obligated,total_outlayed_amount_for_overall_award,base_and_exercised_options_value,current_total_value_of_award,base_and_all_options_value,potential_total_value_of_award,disaster_emergency_fund_codes_for_overall_award,outlayed_amount_from_COVID-19_supplementals_for_overall_award,obligated_amount_from_COVID-19_supplementals_for_overall_award,outlayed_amount_from_IIJA_supplemental_for_overall_award,obligated_amount_from_IIJA_supplemental_for_overall_award,action_date,action_date_fiscal_year,period_of_performance_start_date,period_of_performance_current_end_date,period_of_performance_potential_end_date,ordering_period_end_date,solicitation_date,awarding_agency_code,awarding_agency_name,awarding_sub_agency_code,awarding_sub_agency_name,awarding_office_code,awarding_office_name,funding_agency_code,funding_agency_name,funding_sub_agency_code,funding_sub_agency_name,funding_office_code,funding_office_name,treasury_accounts_funding_this_award,federal_accounts_funding_this_award,object_classes_funding_this_award,program_activities_funding_this_award,foreign_funding,foreign_funding_description,sam_exception,sam_exception_description,recipient_uei,recipient_duns,recipient_name,recipient_name_raw,recipient_doing_business_as_name,cage_code,recipient_parent_uei,recipient_parent_duns,recipient_parent_name,recipient_parent_name_raw,recipient_country_code,recipient_country_name,recipient_address_line_1,recipient_address_line_2,recipient_city_name,prime_award_transaction_recipient_county_fips_code,recipient_county_name,prime_award_transaction_recipient_state_fips_code,recipient_state_code,recipient_state_name,recipient_zip_4_code,prime_award_transaction_recipient_cd_original,prime_award_transaction_recipient_cd_current,recipient_phone_number,recipient_fax_number,primary_place_of_performance_country_code,primary_place_of_performance_country_name,primary_place_of_performance_city_name,prime_award_transaction_place_of_performance_county_fips_code,primary_place_of_performance_county_name,prime_award_transaction_place_of_performance_state_fips_code,primary_place_of_performance_state_code,primary_place_of_performance_state_name,primary_place_of_performance_zip_4,prime_award_transaction_place_of_performance_cd_original,prime_award_transaction_place_of_performance_cd_current,award_or_idv_flag,award_type_code,award_type,idv_type_code,idv_type,multiple_or_single_award_idv_code,multiple_or_single_award_idv,type_of_idc_code,type_of_idc,type_of_contract_pricing_code,type_of_contract_pricing,transaction_description,prime_award_base_transaction_description,action_type_code,action_type,solicitation_identifier,number_of_actions,inherently_governmental_functions,inherently_governmental_functions_description,product_or_service_code,product_or_service_code_description,contract_bundling_code,contract_bundling,dod_claimant_program_code,dod_claimant_program_description,naics_code,naics_description,recovered_materials_sustainability_code,recovered_materials_sustainability,domestic_or_foreign_entity_code,domestic_or_foreign_entity,dod_acquisition_program_code,dod_acquisition_program_description,information_technology_commercial_item_category_code,information_technology_commercial_item_category,epa_designated_product_code,epa_designated_product,country_of_product_or_service_origin_code,country_of_product_or_service_origin,place_of_manufacture_code,place_of_manufacture,subcontracting_plan_code,subcontracting_plan,extent_competed_code,extent_competed,solicitation_procedures_code,solicitation_procedures,type_of_set_aside_code,type_of_set_aside,evaluated_preference_code,evaluated_preference,research_code,research,fair_opportunity_limited_sources_code,fair_opportunity_limited_sources,other_than_full_and_open_competition_code,other_than_full_and_open_competition,number_of_offers_received,commercial_item_acquisition_procedures_code,commercial_item_acquisition_procedures,small_business_competitiveness_demonstration_program,simplified_procedures_for_certain_commercial_items_code,simplified_procedures_for_certain_commercial_items,a76_fair_act_action_code,a76_fair_act_action,fed_biz_opps_code,fed_biz_opps,local_area_set_aside_code,local_area_set_aside,price_evaluation_adjustment_preference_percent_difference,clinger_cohen_act_planning_code,clinger_cohen_act_planning,materials_supplies_articles_equipment_code,materials_supplies_articles_equipment,labor_standards_code,labor_standards,construction_wage_rate_requirements_code,construction_wage_rate_requirements,interagency_contracting_authority_code,interagency_contracting_authority,other_statutory_authority,program_acronym,parent_award_type_code,parent_award_type,parent_award_single_or_multiple_code,parent_award_single_or_multiple,major_program,national_interest_action_code,national_interest_action,cost_or_pricing_data_code,cost_or_pricing_data,cost_accounting_standards_clause_code,cost_accounting_standards_clause,government_furnished_property_code,government_furnished_property,sea_transportation_code,sea_transportation,undefinitized_action_code,undefinitized_action,consolidated_contract_code,consolidated_contract,performance_based_service_acquisition_code,performance_based_service_acquisition,multi_year_contract_code,multi_year_contract,contract_financing_code,contract_financing,purchase_card_as_payment_method_code,purchase_card_as_payment_method,contingency_humanitarian_or_peacekeeping_operation_code,contingency_humanitarian_or_peacekeeping_operation,alaskan_native_corporation_owned_firm,american_indian_owned_business,indian_tribe_federally_recognized,native_hawaiian_organization_owned_firm,tribally_owned_firm,veteran_owned_business,service_disabled_veteran_owned_business,woman_owned_business,women_owned_small_business,economically_disadvantaged_women_owned_small_business,joint_venture_women_owned_small_business,joint_venture_economic_disadvantaged_women_owned_small_bus,minority_owned_business,subcontinent_asian_asian_indian_american_owned_business,asian_pacific_american_owned_business,black_american_owned_business,hispanic_american_owned_business,native_american_owned_business,other_minority_owned_business,contracting_officers_determination_of_business_size,contracting_officers_determination_of_business_size_code,emerging_small_business,community_developed_corporation_owned_firm,labor_surplus_area_firm,us_federal_government,federally_funded_research_and_development_corp,federal_agency,us_state_government,us_local_government,city_local_government,county_local_government,inter_municipal_local_government,local_government_owned,municipality_local_government,school_district_local_government,township_local_government,us_tribal_government,foreign_government,organizational_type,corporate_entity_not_tax_exempt,corporate_entity_tax_exempt,partnership_or_limited_liability_partnership,sole_proprietorship,small_agricultural_cooperative,international_organization,us_government_entity,community_development_corporation,domestic_shelter,educational_institution,foundation,hospital_flag,manufacturer_of_goods,veterinary_hospital,hispanic_servicing_institution,receives_contracts,receives_financial_assistance,receives_contracts_and_financial_assistance,airport_authority,council_of_governments,housing_authorities_public_tribal,interstate_entity,planning_commission,port_authority,transit_authority,subchapter_scorporation,limited_liability_corporation,foreign_owned,for_profit_organization,nonprofit_organization,other_not_for_profit_organization,the_ability_one_program,private_university_or_college,state_controlled_institution_of_higher_learning,1862_land_grant_college,1890_land_grant_college,1994_land_grant_college,minority_institution,historically_black_college,tribal_college,alaskan_native_servicing_institution,native_hawaiian_servicing_institution,school_of_forestry,veterinary_college,dot_certified_disadvantage,self_certified_small_disadvantaged_business,small_disadvantaged_business,c8a_program_participant,historically_underutilized_business_zone_hubzone_firm,sba_certified_8a_joint_venture,highly_compensated_officer_1_name,highly_compensated_officer_1_amount,highly_compensated_officer_2_name,highly_compensated_officer_2_amount,highly_compensated_officer_3_name,highly_compensated_officer_3_amount,highly_compensated_officer_4_name,highly_compensated_officer_4_amount,highly_compensated_officer_5_name,highly_compensated_officer_5_amount,usaspending_permalink,initial_report_date,last_modified_date
7527_3600_75H71022F80084_P00003_36F79719D0135_0,CONT_AWD_75H71022F80084_7527_36F79719D0135_3600,75H71022F80084,P00003,0,3600,"VETERANS AFFAIRS, DEPARTMENT OF",36F79719D0135,P00003,0.00,463000.00,364337.60,0.00,463000.00,0.00,463000.00,Q: Not Designated Nonemergency/Emergency/Disaster/Wildfire Suppression,,,,,2023-12-29,2024,2021-12-30,2024-02-29,2024-02-29 00:00:00,,2019-03-08,075,Department of Health and Human Services,7527,Indian Health Service,75H710,NAVAJO AREA INDIAN HEALTH SVC,075,Department of Health and Human Services,7527,Indian Health Service,75H710,NAVAJO AREA INDIAN HEALTH SVC,075-X-0390-000,075-0390,"23.3: Communications, utilities, and miscellaneous charges",0801: INDIAN HEALTH SERVICES (REIMBURSABLE),X,NOT APPLICABLE,,,RTB3DEMJ91U4,,SCRIPTPRO USA INC,SCRIPTPRO USA INC,,1FYZ2,JPGENB7DDVN9,,SCRIPTPRO LLC,SCRIPTPRO LLC,USA,UNITED STATES,5828 REEDS RD,,SHAWNEE MISSION,20091,JOHNSON,20,KS,KANSAS,662022740,KS-03,KS-03,9133841008,9134324735,USA,UNITED STATES,SHIPROCK,35045,SAN JUAN,35,NM,NEW MEXICO,874203790,NM-03,NM-03,AWARD,C,DELIVERY ORDER,,,,,,,J,FIRM FIXED PRICE,SUPPLEMENTAL AGREEMENT OF WORK WITHIN SCOPE - EXTEND POP,EXERCISE OPTION YEAR 3 SCRIPTPRO FOR THE PHARMACY DEPT. AT NNMC.,B,SUPPLEMENTAL AGREEMENT FOR WORK WITHIN SCOPE,,1,OT,OTHER FUNCTIONS,W065,"LEASE OR RENTAL OF EQUIPMENT- MEDICAL, DENTAL, AND VETERINARY EQUIPMENT AND SUPPLIES",H,NOT BUNDLED,,,339112,SURGICAL AND MEDICAL INSTRUMENT MANUFACTURING,C,NO CLAUSES INCLUDED AND NO SUSTAINABILITY INCLUDED,A,U.S. OWNED BUSINESS,,,,,E,NOT REQUIRED,USA,UNITED STATES,C,NOT A MANUFACTURED END PRODUCT,G,COMMERCIAL SUBCONTRACT PLAN,A,FULL AND OPEN COMPETITION,MAFO,SUBJECT TO MULTIPLE AWARD FAIR OPPORTUNITY,,,NONE,NO PREFERENCE USED,,,FAIR,FAIR OPPORTUNITY GIVEN,,,1,A,COMMERCIAL PRODUCTS/SERVICES,f,N,NO,N,NO,Y,YES,N,NO,,N,NO,X,NOT APPLICABLE,X,NOT APPLICABLE,X,NOT APPLICABLE,X,NOT APPLICABLE,,,C,FSS,M,MULTIPLE AWARD,,NONE,NONE,,,,,N,TRANSACTION DOES NOT USE GFE/GFP,,,X,NO,D,NOT CONSOLIDATED,Y,YES - SERVICE WHERE PBA IS USED.,,,,,N,NO,X,NOT APPLICABLE,f,f,f,f,f,f,f,f,f,f,f,f,f,f,f,f,f,f,f,OTHER THAN SMALL BUSINESS,O,f,f,f,f,f,f,f,f,f,f,f,f,f,f,f,f,f,CORPORATE NOT TAX EXEMPT,t,f,f,f,f,f,f,f,f,f,f,f,t,f,f,f,f,t,f,f,f,f,f,f,f,f,f,f,t,f,f,f,f,f,f,f,f,f,f,f,f,f,f,f,f,f,f,f,f,f,,,,,,,,,,,https://www.usaspending.gov/award/CONT_AWD_75H71022F80084_7527_36F79719D0135_3600/,2023-12-28,2023-12-29
7527_7527_75H71324F29005_0_75H71320D00006_0,CONT_AWD_75H71324F29005_7527_75H71320D00006_7527,75H71324F29005,0,0,7527,INDIAN HEALTH SERVICE,75H71320D00006,0,249900.00,249900.00,129287.14,249900.00,249900.00,249900.00,249900.00,V: Non-emergency P.L. 117-2,129287.14,249900.00,,,2023-12-29,2024,2023-12-29,2024-11-22,2024-11-22 00:00:00,,2023-12-29,075,Department of Health and Human Services,7527,Indian Health Service,75H713,INDIAN HEALTH SERVICE,075,Department of Health and Human Services,7527,Indian Health Service,75H713,INDIAN HEALTH SERVICE,075-X-0390-000,075-0390,25.2: Other services from non-Federal sources,0001: CLINICAL SERVICES,X,NOT APPLICABLE,,,R8RQSQHJGMV6,,PRAIRIE BAND HEALTH SERVICES INC,PRAIRIE BAND HEALTH SERVICES,,570V0,R8RQSQHJGMV6,,PRAIRIE BAND HEALTH SERVICES INC,PRAIRIE BAND HEALTH SERVICES INC,USA,UNITED STATES,16281 Q RD,,MAYETTA,20085,JACKSON,20,KS,KANSAS,665098970,KS-01,KS-01,7853642328,7857835626,USA,UNITED STATES,WARM SPRINGS,41031,JEFFERSON,41,OR,OREGON,977610003,OR-02,OR-02,AWARD,C,DELIVERY ORDER,,,,,,,J,FIRM FIXED PRICE,LOCUM TENENS OPTOMERIST FOR WARM SPRINGS SERVICE UNIT,LOCUM TENENS OPTOMERIST FOR WARM SPRINGS SERVICE UNIT,,,,1,OT,OTHER FUNCTIONS,Q512,MEDICAL- OPTOMETRY,H,NOT BUNDLED,,,621320,OFFICES OF OPTOMETRISTS,C,NO CLAUSES INCLUDED AND NO SUSTAINABILITY INCLUDED,A,U.S. OWNED BUSINESS,,,,,E,NOT REQUIRED,USA,UNITED STATES,C,NOT A MANUFACTURED END PRODUCT,B,PLAN NOT REQUIRED,D,FULL AND OPEN COMPETITION AFTER EXCLUSION OF SOURCES,MAFO,SUBJECT TO MULTIPLE AWARD FAIR OPPORTUNITY,,,NONE,NO PREFERENCE USED,,,FAIR,FAIR OPPORTUNITY GIVEN,,,1,A,COMMERCIAL PRODUCTS/SERVICES,f,N,NO,N,NO,Y,YES,N,NO,,N,NO,X,NOT APPLICABLE,X,NOT APPLICABLE,X,NOT APPLICABLE,X,NOT APPLICABLE,,,B,IDC,M,MULTIPLE AWARD,,NONE,NONE,N,NO,X,NOT APPLICABLE EXEMPT FROM CAS,N,TRANSACTION DOES NOT USE GFE/GFP,,,X,NO,D,NOT CONSOLIDATED,Y,YES - SERVICE WHERE PBA IS USED.,N,NO,,,N,NO,X,NOT APPLICABLE,f,f,t,f,t,f,f,f,f,f,f,f,t,f,f,f,f,t,f,SMALL BUSINESS,S,f,f,f,f,f,f,f,f,f,f,f,f,f,f,f,f,f,CORPORATE TAX EXEMPT,f,t,f,f,f,f,f,f,f,f,f,f,f,f,f,f,f,t,f,f,f,f,f,f,f,f,f,f,t,f,f,f,f,f,f,f,f,f,f,f,f,f,f,f,f,t,f,t,f,f,,,,,,,,,,,https://www.usaspending.gov/award/CONT_AWD_75H71324F29005_7527_75H71320D00006_7527/,2023-12-29,2023-12-29
7527_-NONE-_75H71123P00638_P00001_-NONE-_0,CONT_AWD_75H71123P00638_7527_-NONE-_-NONE-,75H71123P00638,P00001,0,,,,,-388.00,92713.90,220340.56,-388.00,92713.90,-388.00,92713.90,Q: Not Designated Nonemergency/Emergency/Disaster/Wildfire Suppression,,,,,2023-12-28,2024,2023-09-18,2024-07-31,2024-07-31 00:00:00,,,075,Department of Health and Human Services,7527,Indian Health Service,75H711,OK CITY AREA INDIAN HEALTH SVC,075,Department of Health and Human Services,7527,Indian Health Service,75H711,OK CITY AREA INDIAN HEALTH SVC,075-X-0390-000,075-0390,"23.3: Communications, utilities, and miscellaneous charges;25.7: Operation and maintenance of equipment",0801: INDIAN HEALTH SERVICES (REIMBURSABLE),X,NOT APPLICABLE,,,RTB3DEMJ91U4,,SCRIPTPRO USA INC,SCRIPTPRO USA INC,,1FYZ2,JPGENB7DDVN9,,SCRIPTPRO LLC,SCRIPTPRO LLC,USA,UNITED STATES,5828 REEDS RD,,MISSION,20091,JOHNSON,20,KS,KANSAS,662022740,KS-03,KS-03,9133841008,9134035636,USA,UNITED STATES,LAWTON,40031,COMANCHE,40,OK,OKLAHOMA,735073002,OK-04,OK-04,AWARD,B,PURCHASE ORDER,,,,,,,J,FIRM FIXED PRICE,PHARMACY SUPPORT AND RENTAL,PHARMACY SUPPORT AND RENTAL,B,SUPPLEMENTAL AGREEMENT FOR WORK WITHIN SCOPE,,1,,,6515,"MEDICAL AND SURGICAL INSTRUMENTS, EQUIPMENT, AND SUPPLIES",H,NOT BUNDLED,,,339112,SURGICAL AND MEDICAL INSTRUMENT MANUFACTURING,C,NO CLAUSES INCLUDED AND NO SUSTAINABILITY INCLUDED,A,U.S. OWNED BUSINESS,,,,,E,NOT REQUIRED,USA,UNITED STATES,D,MFG IN U.S.,B,PLAN NOT REQUIRED,F,COMPETED UNDER SAP,SP1,SIMPLIFIED ACQUISITION,NONE,NO SET ASIDE USED.,NONE,NO PREFERENCE USED,,,,,,,1,A,COMMERCIAL PRODUCTS/SERVICES,f,N,NO,,,X,NOT APPLICABLE,N,NO,,N,NO,X,NOT APPLICABLE,X,NOT APPLICABLE,X,NOT APPLICABLE,X,NOT APPLICABLE,,,,,,,,NONE,NONE,,,,,N,TRANSACTION DOES NOT USE GFE/GFP,,,X,NO,D,NOT CONSOLIDATED,X,NOT APPLICABLE,,,,,N,NO,X,NOT APPLICABLE,f,f,f,f,f,f,f,f,f,f,f,f,f,f,f,f,f,f,f,OTHER THAN SMALL BUSINESS,O,f,f,f,f,f,f,f,f,f,f,f,f,f,f,f,f,f,CORPORATE NOT TAX EXEMPT,t,f,f,f,f,f,f,f,f,f,f,f,t,f,f,f,f,t,f,f,f,f,f,f,f,f,f,f,t,f,f,f,f,f,f,f,f,f,f,f,f,f,f,f,f,f,f,f,f,f,,,,,,,,,,,https://www.usaspending.gov/award/CONT_AWD_75H71123P00638_7527_-NONE-_-NONE-/,2023-12-28,2024-01-08
7527_3600_75H71221F80250_P00003_36F79719D0135_0,CONT_AWD_75H71221F80250_7527_36F79719D0135_3600,75H71221F80250,P00003,0,3600,"VETERANS AFFAIRS, DEPARTMENT OF",36F79719D0135,P00003,42335.28,646406.74,674089.71,42335.28,646406.74,0.00,731077.30,Q: Not Designated Nonemergency/Emergency/Disaster/Wildfire Suppression,,,,,2023-12-28,2024,2021-09-25,2024-12-31,2026-12-31 00:00:00,,2021-09-07,075,Department of Health and Human Services,7527,Indian Health Service,75H712,PHOENIX AREA INDIAN HEALTH SVC,075,Department of Health and Human Services,7527,Indian Health Service,75H712,PHOENIX AREA INDIAN HEALTH SVC,075-X-0390-000,075-0390,25.2: Other services from non-Federal sources;26.0: Supplies and materials;31.0: Equipment,0801: INDIAN HEALTH SERVICES (REIMBURSABLE),X,NOT APPLICABLE,,,RTB3DEMJ91U4,,SCRIPTPRO USA INC,SCRIPTPRO USA INC,,1FYZ2,JPGENB7DDVN9,,SCRIPTPRO LLC,SCRIPTPRO LLC,USA,UNITED STATES,5828 REEDS RD,,SHAWNEE MISSION,20091,JOHNSON,20,KS,KANSAS,662022740,KS-03,KS-03,9133841008,9134324735,USA,UNITED STATES,POLACCA,04017,NAVAJO,04,AZ,ARIZONA,860424000,AZ-02,AZ-02,AWARD,C,DELIVERY ORDER,,,,,,,J,FIRM FIXED PRICE,"SCRIPTPRO, HHCC","SCRIPTPRO, HHCC",G,EXERCISE AN OPTION,RFQ1520490,1,,,6515,"MEDICAL AND SURGICAL INSTRUMENTS, EQUIPMENT, AND SUPPLIES",H,NOT BUNDLED,,,339112,SURGICAL AND MEDICAL INSTRUMENT MANUFACTURING,D,ENERGY EFFICIENT,A,U.S. OWNED BUSINESS,,,,,A,MEETS REQUIREMENTS,USA,UNITED STATES,D,MFG IN U.S.,G,COMMERCIAL SUBCONTRACT PLAN,A,FULL AND OPEN COMPETITION,MAFO,SUBJECT TO MULTIPLE AWARD FAIR OPPORTUNITY,,,NONE,NO PREFERENCE USED,,,FAIR,FAIR OPPORTUNITY GIVEN,,,1,A,COMMERCIAL PRODUCTS/SERVICES,f,N,NO,N,NO,Y,YES,N,NO,,N,NO,X,NOT APPLICABLE,X,NOT APPLICABLE,X,NOT APPLICABLE,X,NOT APPLICABLE,,,C,FSS,M,MULTIPLE AWARD,,NONE,NONE,,,,,N,TRANSACTION DOES NOT USE GFE/GFP,,,X,NO,D,NOT CONSOLIDATED,X,NOT APPLICABLE,,,,,N,NO,X,NOT APPLICABLE,f,f,f,f,f,f,f,f,f,f,f,f,f,f,f,f,f,f,f,OTHER THAN SMALL BUSINESS,O,f,f,f,f,f,f,f,f,f,f,f,f,f,f,f,f,f,CORPORATE NOT TAX EXEMPT,t,f,f,f,f,f,f,f,f,f,f,f,t,f,f,f,f,t,f,f,f,f,f,f,f,f,f,f,t,f,f,f,f,f,f,f,f,f,f,f,f,f,f,f,f,f,f,f,f,f,,,,,,,,,,,https://www.usaspending.gov/award/CONT_AWD_75H71221F80250_7527_36F79719D0135_3600/,2023-12-27,2023-12-28
7527_-NONE-_75H71022P00351_P00004_-NONE-_0,CONT_AWD_75H71022P00351_7527_-NONE-_-NONE-,75H71022P00351,P00004,0,,,,,2652.72,272566.08,312632.90,2652.72,272566.08,2652.72,441321.60,Q: Not Designated Nonemergency/Emergency/Disaster/Wildfire Suppression,,,,,2023-12-28,2024,2021-12-29,2024-12-31,2026-12-31 00:00:00,,,075,Department of Health and Human Services,7527,Indian Health Service,75H710,NAVAJO AREA INDIAN HEALTH SVC,075,Department of Health and Human Services,7527,Indian Health Service,75H710,NAVAJO AREA INDIAN HEALTH SVC,075-X-0390-000,075-0390,"23.3: Communications, utilities, and miscellaneous charges;25.2: Other services from non-Federal sources",0801: INDIAN HEALTH SERVICES (REIMBURSABLE),X,NOT APPLICABLE,,,RTB3DEMJ91U4,,SCRIPTPRO USA INC,SCRIPTPRO USA INC,,1FYZ2,JPGENB7DDVN9,,SCRIPTPRO LLC,SCRIPTPRO LLC,USA,UNITED STATES,5828 REEDS RD,,SHAWNEE MISSION,20091,JOHNSON,20,KS,KANSAS,662022740,KS-03,KS-03,9133841008,9134324735,USA,UNITED STATES,GALLUP,35031,MCKINLEY,35,NM,NEW MEXICO,873015748,NM-03,NM-03,AWARD,B,PURCHASE ORDER,,,,,,,J,FIRM FIXED PRICE,MOD 4 - ADD FUNDS FOR SUPPORT FEE INCREASES - PRESCRIPTION FILLING ROBOTIC SYSTEM,FY22 PRESCRIPTION FILLING ROBOTIC SYSTEM,B,SUPPLEMENTAL AGREEMENT FOR WORK WITHIN SCOPE,,1,OT,OTHER FUNCTIONS,W065,"LEASE OR RENTAL OF EQUIPMENT- MEDICAL, DENTAL, AND VETERINARY EQUIPMENT AND SUPPLIES",H,NOT BUNDLED,,,333318,OTHER COMMERCIAL AND SERVICE INDUSTRY MACHINERY MANUFACTURING,C,NO CLAUSES INCLUDED AND NO SUSTAINABILITY INCLUDED,A,U.S. OWNED BUSINESS,,,,,E,NOT REQUIRED,USA,UNITED STATES,C,NOT A MANUFACTURED END PRODUCT,B,PLAN NOT REQUIRED,G,NOT COMPETED UNDER SAP,SP1,SIMPLIFIED ACQUISITION,NONE,NO SET ASIDE USED.,NONE,NO PREFERENCE USED,,,,,SP2,SAP NON-COMPETITION (FAR 13),1,A,COMMERCIAL PRODUCTS/SERVICES,f,N,NO,N,NO,X,NOT APPLICABLE,N,NO,,N,NO,X,NOT APPLICABLE,X,NOT APPLICABLE,X,NOT APPLICABLE,X,NOT APPLICABLE,,,,,,,,NONE,NONE,,,,,N,TRANSACTION DOES NOT USE GFE/GFP,,,X,NO,D,NOT CONSOLIDATED,N,NO - SERVICE WHERE PBA IS NOT USED.,,,,,N,NO,X,NOT APPLICABLE,f,f,f,f,f,f,f,f,f,f,f,f,f,f,f,f,f,f,f,SMALL BUSINESS,S,f,f,f,f,f,f,f,f,f,f,f,f,f,f,f,f,f,CORPORATE NOT TAX EXEMPT,t,f,f,f,f,f,f,f,f,f,f,f,t,f,f,f,f,t,f,f,f,f,f,f,f,f,f,f,t,f,f,f,f,f,f,f,f,f,f,f,f,f,f,f,f,f,f,f,f,f,,,,,,,,,,,https://www.usaspending.gov/award/CONT_AWD_75H71022P00351_7527_-NONE-_-NONE-/,2023-12-27,2023-12-28
7527_-NONE-_75H70623C00017_P00003_-NONE-_0,CONT_AWD_75H70623C00017_7527_-NONE-_-NONE-,75H70623C00017,P00003,0,,,,,924152.76,1804335.23,2287492.57,924152.76,1804335.23,54435.92,4413485.75,Q: Not Designated Nonemergency/Emergency/Disaster/Wildfire Suppression,,,,,2023-12-26,2024,2023-04-11,2024-12-31,2027-12-31 00:00:00,,2022-12-05,075,Department of Health and Human Services,7527,Indian Health Service,75H706,GREAT PLAINS AREA INDIAN HEALTH SVC,075,Department of Health and Human Services,7527,Indian Health Service,75H706,GREAT PLAINS AREA INDIAN HEALTH SVC,075-X-0390-000,075-0390,25.2: Other services from non-Federal sources;26.0: Supplies and materials,0801: INDIAN HEALTH SERVICES (REIMBURSABLE),X,NOT APPLICABLE,,,RTB3DEMJ91U4,,SCRIPTPRO USA INC,SCRIPTPRO USA INC,,1FYZ2,JPGENB7DDVN9,,SCRIPTPRO LLC,SCRIPTPRO LLC,USA,UNITED STATES,5828 REEDS RD,,MISSION,20091,JOHNSON,20,KS,KANSAS,662022740,KS-03,KS-03,9133841008,9134324735,USA,UNITED STATES,PIERRE,46065,HUGHES,46,SD,SOUTH DAKOTA,575015477,SD-00,SD-00,AWARD,D,DEFINITIVE CONTRACT,,,,,,,J,FIRM FIXED PRICE,"MODIFICATION NO. THREE (P00003) EXERCISES OPTION YEAR ONE (1) OF FOUR FOR AREAWIDE SERVICE, TECHNICAL SUPPORT AND MAINTENANCE AGREEMENT (S&MA) FOR LEASED SCRIPTPRO DISPENSING SYSTEMS AND SUPPORTING HARDWARE/SOFTWARE AT IHS FACILITIES WITHIN THE G","FIRM FIXED PRICE, BASE PLUS FOUR OPTION YEAR CONTRACT FOR AREAWIDE SERVICE, TECHNICAL SUPPORT AND MAINTENANCE AGREEMENT (S&MA) FOR LEASED SCRIPTPRO DISPENSING SYSTEM(S) AND SUPPORTING HARDWARE/SOFTWARE AT IHS FACILITIES WITHIN THE GREAT PLAINS AR",G,EXERCISE AN OPTION,GPA-CES-20-0001,1,OT,OTHER FUNCTIONS,J065,"MAINT/REPAIR/REBUILD OF EQUIPMENT- MEDICAL, DENTAL, AND VETERINARY EQUIPMENT AND SUPPLIES",H,NOT BUNDLED,,,532490,OTHER COMMERCIAL AND INDUSTRIAL MACHINERY AND EQUIPMENT RENTAL AND LEASING,C,NO CLAUSES INCLUDED AND NO SUSTAINABILITY INCLUDED,A,U.S. OWNED BUSINESS,,,,,E,NOT REQUIRED,USA,UNITED STATES,C,NOT A MANUFACTURED END PRODUCT,A,PLAN NOT INCLUDED - NO SUBCONTRACTING POSSIBILITIES,C,NOT COMPETED,SSS,ONLY ONE SOURCE,NONE,NO SET ASIDE USED.,NONE,NO PREFERENCE USED,,,,,PDR,PATENT OR DATA RIGHTS (FAR 6.302-1(B)(2)),1,A,COMMERCIAL PRODUCTS/SERVICES,f,N,NO,,,Y,YES,N,NO,0.00,N,NO,N,NO,N,NO,N,NO,X,NOT APPLICABLE,,,,,,,,NONE,NONE,N,NO,X,NOT APPLICABLE EXEMPT FROM CAS,N,TRANSACTION DOES NOT USE GFE/GFP,,,X,NO,D,NOT CONSOLIDATED,N,NO - SERVICE WHERE PBA IS NOT USED.,N,NO,,,N,NO,X,NOT APPLICABLE,f,f,f,f,f,f,f,f,f,f,f,f,f,f,f,f,f,f,f,OTHER THAN SMALL BUSINESS,O,f,f,f,f,f,f,f,f,f,f,f,f,f,f,f,f,f,CORPORATE NOT TAX EXEMPT,t,f,f,f,f,f,f,f,f,f,f,f,t,f,f,f,f,t,f,f,f,f,f,f,f,f,f,f,t,f,f,f,f,f,f,f,f,f,f,f,f,f,f,f,f,f,f,f,f,f,,,,,,,,,,,https://www.usaspending.gov/award/CONT_AWD_75H70623C00017_7527_-NONE-_-NONE-/,2023-12-12,2023-12-26
7527_-NONE-_75H71124P00056_0_-NONE-_0,CONT_AWD_75H71124P00056_7527_-NONE-_-NONE-,75H71124P00056,0,0,,,,,15410.00,6740.84,6740.84,15410.00,6740.84,15410.00,6740.84,Z: Emergency P.L. 117-58,,,6740.84,6740.84,2023-12-22,2024,2023-12-21,2024-03-30,2024-03-30 00:00:00,,,075,Department of Health and Human Services,7527,Indian Health Service,75H711,OK CITY AREA INDIAN HEALTH SVC,075,Department of Health and Human Services,7527,Indian Health Service,75H711,OK CITY AREA INDIAN HEALTH SVC,075-X-0391-000,075-0391,25.2: Other services from non-Federal sources,0003: FACILITIES AND ENVIRONMENTAL HEALTH,X,NOT APPLICABLE,,,E15HMNJ75JJ8,,LARRY KRANZ,LARRY KRANZ,,36EE1,E15HMNJ75JJ8,,LARRY KRANZ,KRANZ  LARRY L,USA,UNITED STATES,26663 Y RD,,WHITING,20085,JACKSON,20,KS,KANSAS,665529456,KS-02,KS-02,7858723125,7858723125,USA,UNITED STATES,HORTON,20013,BROWN,20,KS,KANSAS,664399501,KS-02,KS-02,AWARD,B,PURCHASE ORDER,,,,,,,J,FIRM FIXED PRICE,REHABILITATION OF A LAGOON AND APPURTENANCES.,REHABILITATION OF A LAGOON AND APPURTENANCES.,,,246-24-Q-0010,1,OT,OTHER FUNCTIONS,Y1ND,CONSTRUCTION OF SEWAGE AND WASTE FACILITIES,H,NOT BUNDLED,,,237110,WATER AND SEWER LINE AND RELATED STRUCTURES CONSTRUCTION,C,NO CLAUSES INCLUDED AND NO SUSTAINABILITY INCLUDED,A,U.S. OWNED BUSINESS,,,,,E,NOT REQUIRED,USA,UNITED STATES,C,NOT A MANUFACTURED END PRODUCT,B,PLAN NOT REQUIRED,F,COMPETED UNDER SAP,SP1,SIMPLIFIED ACQUISITION,SBA,SMALL BUSINESS SET ASIDE - TOTAL,NONE,NO PREFERENCE USED,,,,,,,6,D,COMMERCIAL PRODUCTS/SERVICES PROCEDURES NOT USED,f,N,NO,,,Y,YES,N,NO,,N,NO,N,NO,N,NO,Y,YES,X,NOT APPLICABLE,,,,,,,,NONE,NONE,,,,,N,TRANSACTION DOES NOT USE GFE/GFP,,,X,NO,D,NOT CONSOLIDATED,N,NO - SERVICE WHERE PBA IS NOT USED.,,,Z,NOT APPLICABLE,N,NO,X,NOT APPLICABLE,f,f,f,f,f,f,f,f,f,f,f,f,f,f,f,f,f,f,f,SMALL BUSINESS,S,f,f,f,f,f,f,f,f,f,f,f,f,f,f,f,f,f,SOLE PROPRIETORSHIP,f,f,f,t,f,f,f,f,f,f,f,f,f,f,f,f,f,t,f,f,f,f,f,f,f,f,f,f,t,f,f,f,f,f,f,f,f,f,f,f,f,f,f,f,f,t,f,f,f,f,,,,,,,,,,,https://www.usaspending.gov/award/CONT_AWD_75H71124P00056_7527_-NONE-_-NONE-/,2023-12-21,2025-03-31
